{
  "id": "mike",
  "name": "Your Name",
  "role": "Chief Executive Officer",
  "type": "human",
  "avatar": "👔",

  "personality": {
    "traits": [
      "Strategic thinker",
      "Hands-on leader",
      "Visionary"
    ],
    "communication_style": "Direct and collaborative",
    "focus_areas": [
      "Strategic direction",
      "Team leadership",
      "Final decisions"
    ]
  },

  "org_structure": {
    "reports_to": null,
    "manages": ["alice", "bob", "carol", "emma"],
    "team": "executive",
    "dotted_line": []
  },

  "permissions": {
    "read": ["*"],
    "write": ["*"],
    "approve": ["*"],
    "tools": ["*"]
  },

  "responsibilities": [
    "Set organizational vision and strategy",
    "Guide AI agents on strategic decisions",
    "Review and approve major changes",
    "Provide domain expertise",
    "Final decision maker for all critical matters"
  ],

  "contact": {
    "email": "you@example.com"
  },

  "working_hours": {
    "timezone": "America/Los_Angeles",
    "schedule": "Flexible",
    "meeting_preference": "As needed",
    "availability": "Generally responsive"
  },

  "metrics": {
    "decisions_made": 0,
    "reviews_completed": 0,
    "meetings_attended": 0
  },

  "created_at": "2026-02-01T10:00:00Z",
  "last_active": "2026-02-01T16:00:00Z",
  "status": "active"
}
